{
	"name": "normalizer",
	"version": "1.0.0",
	"description": "",
	"author": "me",
	"license": "MPL-2.0",
	"randomSeed": 1,
	"targets": [
		{
			"name": "native",
			"generator": "c",
			"output": "normalizer.asm",
			"options": [
			]
		},
		{
			"name": "default",
			"generator": "js",
			"output": "normalizer.js",
			"options": [
				"nodejs"
			]
		}
	],
	"entry": "main"
}
